;;;;;;;;;;;;;;;;;;;;;;;;;;;;;x
EVTNAME955181;The Senegal-Guinea Border Treaty;;;;;;;;;;;;;;;x,,,,,,,,,,,,,,,,,,,,
EVTDESC955181;A dispute arose with $FROMCOUNTRY$ over our colonial borders in Senegal and Guinea. $FROMCOUNTRY_ADJ$ citizens poured through the border and are now living in Ziguinchor province. According to the principles of effective occupation established in Conference of Berlin, the territory belong to us. But it has been under partial rule of another nation for a long time and thus the dispute arose. The $FROMCOUNTRY_ADJ$ government approached us and proposed an exchange - Gabu for Ziguinchor and all the claims would be settled.;;;;;;;;;;;;;;;x,,,,,,,,,,,,,,,,,,,,
EVTDESC955202;A dispute arose with $FROMCOUNTRY$ over our colonial borders in Senegal and Guinea. $FROMCOUNTRY_ADJ$ citizens poured through the border and are now living in Ziguinchor province. According to the principles of effective occupation established in Conference of Berlin, the territory belong to us. But it has been under partial rule of another nation for a long time and thus the dispute arose. The $FROMCOUNTRY_ADJ$ government approached us and proposed an exchange - they will pay us an indemnity in exchange of a complete forfeit of all our claims on Ziguinchor.;;;;;;;;;;;;;;;x,,,,,,,,,,,,,,,,,,,,
EVTNAME955204;The Gabu Purchase;;;;;;;;;;;;;;;x,,,,,,,,,,,,,,,,,,,,
EVTDESC955204;$FROMCOUNTRY$ approached us with an offer to buy Gabu. They claim it as part of the principle of effective occupation, delineated in Article 34 of the Great Powers conference about West Africa but they were lenient and didn't take de facto control of the land. Some countries see legitimacy in the $COUNTRY_ADJ$ claims and this can escalate in a conflict but no one is exerting pressure on us to sign a deal.;;;;;;;;;;;;;;;x,,,,,,,,,,,,,,,,,,,,
EVT955181OPTA;The deal seems fair.;;;;;;;;;;;;x
EVT955181OPTB;We would never agree to such proposal.;;;;;;;;;;;;x
EVTDESC6016820;Country demobilized. Time to reabsorb. Everything is solved.;;;;;;;;;;;;;;;;;;;;;;;;;;x;;;;;;;;;;;;;;;;;;;;;;;;;;;x;;;;
